{
  "schemaVersion": "0.2",
  "registryRef": "fixture:registry-v1",
  "entityTypes": [
    "human",
    "work",
    "place",
    "concept"
  ],
  "relations": [
    {
      "id": "field_of_work",
      "label": {
        "fr": "Domaine",
        "en": "field of work"
      },
      "domain": [
        "human"
      ],
      "range": "concept",
      "valueKind": "entity",
      "operators": [
        "exists",
        "missing_in_view",
        "in",
        "none_of"
      ]
    },
    {
      "id": "movement",
      "label": {
        "fr": "Courant",
        "en": "movement"
      },
      "domain": [
        "human"
      ],
      "range": "concept",
      "valueKind": "entity",
      "operators": [
        "exists",
        "missing_in_view",
        "in",
        "none_of"
      ]
    },
    {
      "id": "birth_place",
      "label": {
        "fr": "Lieu de naissance",
        "en": "birth place"
      },
      "domain": [
        "human"
      ],
      "range": "place",
      "valueKind": "entity",
      "operators": [
        "exists",
        "missing_in_view",
        "in",
        "none_of"
      ]
    },
    {
      "id": "citizenship",
      "label": {
        "fr": "Citoyenneté",
        "en": "citizenship"
      },
      "domain": [
        "human"
      ],
      "range": "place",
      "valueKind": "entity",
      "operators": [
        "exists",
        "missing_in_view",
        "in",
        "none_of"
      ]
    },
    {
      "id": "religious_tradition",
      "label": {
        "fr": "Tradition religieuse",
        "en": "religious tradition"
      },
      "domain": [
        "human"
      ],
      "range": "concept",
      "valueKind": "entity",
      "operators": [
        "exists",
        "missing_in_view",
        "in",
        "none_of"
      ]
    },
    {
      "id": "author",
      "label": {
        "fr": "Auteur",
        "en": "author"
      },
      "domain": [
        "work"
      ],
      "range": "human",
      "valueKind": "entity",
      "operators": [
        "exists",
        "missing_in_view",
        "in",
        "none_of"
      ],
      "inverseOf": "authored_work"
    },
    {
      "id": "authored_work",
      "label": {
        "fr": "Œuvres",
        "en": "authored work"
      },
      "domain": [
        "human"
      ],
      "range": "work",
      "valueKind": "entity",
      "operators": [
        "exists",
        "missing_in_view",
        "in",
        "none_of"
      ],
      "inverseOf": "author"
    },
    {
      "id": "lifespan",
      "label": {
        "fr": "Période de vie",
        "en": "lifespan"
      },
      "domain": [
        "human"
      ],
      "range": "year_interval",
      "valueKind": "interval",
      "operators": [
        "exists",
        "missing_in_view",
        "overlaps"
      ],
      "derivedRuleRef": "fixture:lifespan-rule-v1"
    }
  ]
}
